{
  "current": {
    "rule_version": "coupon-rule-v2",
    "text": "Welcome, referral and promo coupons are paused, on future orders, for every account of a cluster when a case of the cluster is in Q4 and an operator confirms it; review after 90 days.",
    "approved_by": "luca",
    "approved_at": "2026-09-30T20:00:00Z",
    "supersedes": "coupon-rule-v1",
    "active": true
  },
  "history": [
    {
      "rule_version": "coupon-rule-v2",
      "text": "Welcome, referral and promo coupons are paused, on future orders, for every account of a cluster when a case of the cluster is in Q4 and an operator confirms it; review after 90 days.",
      "approved_by": "luca",
      "approved_at": "2026-09-30T20:00:00Z",
      "supersedes": "coupon-rule-v1",
      "active": true
    },
    {
      "rule_version": "coupon-rule-v1",
      "text": "Welcome coupons and referrals are paused, on future orders, for every account of a cluster when a case of the cluster is in Q4 and an operator confirms it; review after 90 days.",
      "approved_by": "luca",
      "approved_at": "2026-09-29T10:00:00Z",
      "supersedes": null,
      "active": false
    }
  ],
  "applications": [
    {
      "application_id": "CRA-000031",
      "rule_version": "coupon-rule-v1",
      "cluster_id": "CL-000417",
      "decision_id": "DEC-000102-1",
      "affected_customer_ids": [
        "C-MARCO-1",
        "C-MARCO-2",
        "C-MARCO-3",
        "C-MARCO-4",
        "C-MARCO-5",
        "C-MARCO-6",
        "C-MARCO-7"
      ],
      "state": "confirmed",
      "proposed_at": "2026-09-28T09:16:00Z",
      "confirmed_by": "sara",
      "confirmed_at": "2026-09-30T18:20:00Z",
      "review_at": "2026-12-27",
      "reversible": true,
      "reversed_by": null,
      "reversed_at": null,
      "reversal_reason": null,
      "as_of": "2026-09-30T20:00:00Z",
      "in_force": true
    },
    {
      "application_id": "CRA-000027",
      "rule_version": "coupon-rule-v1",
      "cluster_id": "CL-000655",
      "decision_id": "DEC-000077-1",
      "affected_customer_ids": [
        "C-12007",
        "C-12930",
        "C-15561"
      ],
      "state": "reversed",
      "proposed_at": "2026-09-29T14:00:00Z",
      "confirmed_by": "sara",
      "confirmed_at": "2026-09-29T15:00:00Z",
      "review_at": "2026-12-28",
      "reversible": true,
      "reversed_by": "luca",
      "reversed_at": "2026-09-30T17:00:00Z",
      "reversal_reason": "The linked accounts share a pickup point only: application reversed",
      "as_of": "2026-09-30T20:00:00Z",
      "in_force": false
    }
  ],
  "as_of": "2026-09-30T20:00:00Z"
}
